Cites,Authors,Title,Year,Source,Publisher,ArticleURL,CitesURL,GSRank,QueryDate,Type,DOI,ISSN,CitationURL,Volume,Issue,StartPage,EndPage,ECC,CitesPerYear,CitesPerAuthor,AuthorCount,Age,Abstract,FullTextURL,RelatedURL
5,"R Ali, S Muhammad…","Decision making viva genetic algorithm for the utilization of leftovers",2021,"International Journal of …","Wiley Online Library","https://onlinelibrary.wiley.com/doi/abs/10.1002/int.22359?casa_token=sEYQQi-WdQ8AAAAA:d92vCQZf7alcKGeEmnZj4YFtgsVvzb57SG_h8kL-ai48s6El8pBisNu1oy6sJFhAP3Ug4QJBt65h6_up","https://scholar.google.com/scholar?cites=12239624609235977272&as_sdt=2005&sciodt=2007&hl=en",92,"2023-05-11 11:55:16","","10.1002/int.22359","","",,,,,5,2.50,2,3,2,"… the minimization of waste, cutting patterns, and usable leftover in the whole … CSP is presented in which the objective is the minimization of the number of large plates that are used to cut …","https://onlinelibrary.wiley.com/doi/pdf/10.1002/int.22359?casa_token=MH_LL-33QV8AAAAA:p2BcooT0GFqZWIjKTGHFPPsadiAXyrXWeSzD0VESttOl6XNvBqOmfISfK5Bx3ZYOBN6OiMqHw8tQhoP4","https://scholar.google.com/scholar?q=related:OMSj2bvh26kJ:scholar.google.com/&scioq=csp+minimize+cutting+waste&hl=en&as_sdt=2007&as_ylo=2015&as_yhi=2023"
14,"D Wang, F Xiao, L Zhou, Z Liang","Two-dimensional skiving and cutting stock problem with setup cost based on column-and-row generation",2020,"European Journal of Operational …","Elsevier","https://www.sciencedirect.com/science/article/pii/S0377221720302903","https://scholar.google.com/scholar?cites=5860991274749686427&as_sdt=2005&sciodt=2007&hl=en",93,"2023-05-11 11:55:16","","","","",,,,,14,4.67,4,4,3,"… Therefore, we refer to material wastage as material cost in the following … CSPs are solved with the objective of minimizing material cost. However, as mentioned above, minimizing the …","","https://scholar.google.com/scholar?q=related:m3Ie84JsVlEJ:scholar.google.com/&scioq=csp+minimize+cutting+waste&hl=en&as_sdt=2007&as_ylo=2015&as_yhi=2023"
4,"F Brandao, JP Pedroso","Cutting stock with binary patterns: arc-flow formulation with graph compression",2015,"arXiv preprint arXiv:1502.02899","arxiv.org","https://arxiv.org/abs/1502.02899","https://scholar.google.com/scholar?cites=18165757943576750097&as_sdt=2005&sciodt=2007&hl=en",94,"2023-05-11 11:55:16","","","","",,,,,4,0.50,2,2,8,"… The cutting stock problem (CSP) is a combinatorial NP-hard … be cut from rolls in such a way that the waste is minimized. In … solving cutting stock problems with binary patterns (0-1 CSP), …","https://arxiv.org/pdf/1502.02899","https://scholar.google.com/scholar?q=related:EWifdpq8GfwJ:scholar.google.com/&scioq=csp+minimize+cutting+waste&hl=en&as_sdt=2007&as_ylo=2015&as_yhi=2023"
17,"A Di Vaio, L Varriale, A Di Gregorio…","Corporate social performance and non‐financial reporting in the cruise industry: Paving the way towards UN Agenda 2030",2022,"Corporate Social …","Wiley Online Library","https://onlinelibrary.wiley.com/doi/abs/10.1002/csr.2292","https://scholar.google.com/scholar?cites=15060414842600392421&as_sdt=2005&sciodt=2007&hl=en",95,"2023-05-11 11:55:16","","10.1002/csr.2292","","",,,,,17,17.00,4,4,1,"… studies on CSP, still scarce research focuses on CSP in the … The goal was to cut food waste in each step of the shipboard … “The Company seeks to minimize water wastage in all its …","https://onlinelibrary.wiley.com/doi/pdf/10.1002/csr.2292","https://scholar.google.com/scholar?q=related:5YY3f4FXAdEJ:scholar.google.com/&scioq=csp+minimize+cutting+waste&hl=en&as_sdt=2007&as_ylo=2015&as_yhi=2023"
0,"O Saldías, C Guerrero, R Olivares…","A Strategic-Operational Contribution to the One-Dimensional Multi-period Cutting Stock Problem for Sawmills",2022,"Advanced Research in …","Springer","https://link.springer.com/chapter/10.1007/978-3-031-20316-9_3","",96,"2023-05-11 11:55:16","","10.1007/978-3-031-20316-9_3","","",,,,,0,0.00,0,4,1,"… CSP is an NP-HARD problem and can be modeled by integer programming [5]. This model seeks to minimize waste generated by cutting raw … To solve this CSP problem, this study …","","https://scholar.google.com/scholar?q=related:OftG81hy0l8J:scholar.google.com/&scioq=csp+minimize+cutting+waste&hl=en&as_sdt=2007&as_ylo=2015&as_yhi=2023"
47,"M Vanzela, GM Melega, S Rangel…","The integrated lot sizing and cutting stock problem with saw cycle constraints applied to furniture production",2017,"Computers &Operations …","Elsevier","https://www.sciencedirect.com/science/article/pii/S0305054816302635","https://scholar.google.com/scholar?cites=16456614724404409358&as_sdt=2005&sciodt=2007&hl=en",97,"2023-05-11 11:55:16","","","","",,,,,47,7.83,12,4,6,"… of the cutting process in order to reduce raw material waste and … The decisions are taken aiming to minimize the overall costs … CSP model then determines the number of plates to be cut …","https://repositorio.unesp.br/bitstream/handle/11449/178407/2-s2.0-84994802481.pdf?sequence=1","https://scholar.google.com/scholar?q=related:DnSWpeajYeQJ:scholar.google.com/&scioq=csp+minimize+cutting+waste&hl=en&as_sdt=2007&as_ylo=2015&as_yhi=2023"
0,"N Malik","An intelligent framework for computer-aided automation and optimization of Light-Frame Building manufacturing process",2019,"","era.library.ualberta.ca","https://era.library.ualberta.ca/items/8770771e-4874-4b0b-a204-7712d8665332","",98,"2023-05-11 11:55:16","","","","",,,,,0,0.00,0,1,4,"… for dynamically reallocating component cutting waste, tool-… CSP optimization can be adopted to minimize material waste … an effective method of waste minimization (Tam et al. 2005; Tam …","https://era.library.ualberta.ca/items/8770771e-4874-4b0b-a204-7712d8665332/download/59b6db55-9adf-4301-98b5-4d4d85211d00","https://scholar.google.com/scholar?q=related:QOTTtD9VIOQJ:scholar.google.com/&scioq=csp+minimize+cutting+waste&hl=en&as_sdt=2007&as_ylo=2015&as_yhi=2023"
43,"Y Cui, C Zhong, Y Yao","Pattern-set generation algorithm for the one-dimensional cutting stock problem with setup cost",2015,"European Journal of Operational Research","Elsevier","https://www.sciencedirect.com/science/article/pii/S0377221714010169","https://scholar.google.com/scholar?cites=2377542022055154269&as_sdt=2005&sciodt=2007&hl=en",99,"2023-05-11 11:55:16","","","","",,,,,43,5.38,14,3,8,"… The primary objective in the CSP is to minimize material cost. … A heuristic is presented in this paper for the CSP with pattern … the items and takes surplus as waste. Their approach and the …","","https://scholar.google.com/scholar?q=related:XVIpT9-5_iAJ:scholar.google.com/&scioq=csp+minimize+cutting+waste&hl=en&as_sdt=2007&as_ylo=2015&as_yhi=2023"
1,"S Altın, T Aydilek, U Şirvan, D Kesikburun…","Three Dimensional Cutting Stock Problem in Mattress Production: A Case Study",2019,"Proceedings of the …","Springer","https://link.springer.com/chapter/10.1007/978-3-319-92267-6_76","https://scholar.google.com/scholar?cites=12166068504721991330&as_sdt=2005&sciodt=2007&hl=en",100,"2023-05-11 11:55:16","","10.1007/978-3-319-92267-6_76","","",,,,,1,0.25,0,5,4,"… The aim is to minimize total waste in cutting operations. … to solve cutting stock problems, however they require “cutting … for CSP depending on the branch &bound and branch &cut …","https://www.researchgate.net/profile/Damla-Yueksel-3/publication/327042019_Three_Dimensional_Cutting_Stock_Problem_in_Mattress_Production_A_Case_Study/links/5d67bf0fa6fdccf343fc4f62/Three-Dimensional-Cutting-Stock-Problem-in-Mattress-Production-A-Case-Study.pdf","https://scholar.google.com/scholar?q=related:oqYFsdiO1qgJ:scholar.google.com/&scioq=csp+minimize+cutting+waste&hl=en&as_sdt=2007&as_ylo=2015&as_yhi=2023"
2,"LM Pierini, KC Poldi","An analysis of the integrated lot-sizing and cutting-stock problem formulation",2021,"Applied Mathematical Modelling","Elsevier","https://www.sciencedirect.com/science/article/pii/S0307904X21002912","https://scholar.google.com/scholar?cites=2667276822079288133&as_sdt=2005&sciodt=2007&hl=en",101,"2023-05-11 11:55:16","","","","",,,,,2,1.00,1,2,2,"… In addition to the waste and setup minimization, it is relevant to minimize … to minimize setup, inventory and production costs. The CSP specifies the number of reels that will be cut into …","","https://scholar.google.com/scholar?q=related:RTOrSSMSBCUJ:scholar.google.com/&scioq=csp+minimize+cutting+waste&hl=en&as_sdt=2007&as_ylo=2015&as_yhi=2023"
26,"H Li, J Li, W Yao, S Nazarian, X Lin…","Fast and energy-aware resource provisioning and task scheduling for cloud systems",2017,"2017 18th international …","ieeexplore.ieee.org","https://ieeexplore.ieee.org/abstract/document/7918312/?casa_token=DbscMEB7b3cAAAAA:Gyt3uarV1o6uAnoNMRuVdBtCke5vpEC3HC9I1y8becQnW4iEcHfv2r31AZMEpy3hrJF9rArsFktVSQ","https://scholar.google.com/scholar?cites=6478915417492039552&as_sdt=2005&sciodt=2007&hl=en",102,"2023-05-11 11:55:16","","","","",,,,,26,4.33,4,6,6,"… Then according to user workload requests, the CSP starts … minimizing the energy consumption. For VM allocations, a pay-per-use economic model is adopted which can avoid wasting …","https://ieeexplore.ieee.org/iel7/7910185/7918273/07918312.pdf?casa_token=T-HgcqrgZFMAAAAA:ygpH4CnnHPAPXGtOu5NKiUWPmDP5OQWfIfOc_5cj3fLnIjlIPdhb3RlyX91GqLWYV3xVrLLcY_lkyQ","https://scholar.google.com/scholar?q=related:gCdq1T676VkJ:scholar.google.com/&scioq=csp+minimize+cutting+waste&hl=en&as_sdt=2007&as_ylo=2015&as_yhi=2023"
0,"K Ren, L Jia, J Huang, M Wu","Research on cutting stock optimization of rebar engineering based on building information modeling and an improved particle swarm optimization algorithm",2023,"Developments in the Built Environment","Elsevier","https://www.sciencedirect.com/science/article/pii/S2666165923000030","",103,"2023-05-11 11:55:16","HTML","","","",,,,,0,0.00,0,4,1,"… -cutting scheme to reduce the material waste in the rebar-… -stage systematic framework to minimize the loss of rebars by … to the PSO for the 1D-CSP. The essence of the greedy strategy is …","https://www.sciencedirect.com/science/article/pii/S2666165923000030","https://scholar.google.com/scholar?q=related:1dh_B4wOqcIJ:scholar.google.com/&scioq=csp+minimize+cutting+waste&hl=en&as_sdt=2007&as_ylo=2015&as_yhi=2023"
0,"X Hao, C Liu, M Liu, C Zhang, L Zheng","Solving a real-world large-scale cutting stock problem: A clustering-assignment-based model",2022,"IISE Transactions","Taylor &Francis","https://www.tandfonline.com/doi/abs/10.1080/24725854.2022.2133196","",104,"2023-05-11 11:55:16","","10.1080/24725854.2022.2133196","","",,,,,0,0.00,0,5,1,"… and cutting waste by 4.97%, compared with factory’s method. … That is, we aim to minimize board consumption and plate … according to the formulation method of CSP. In each part, we …","https://www.researchgate.net/profile/Liu-Changchun/publication/364217263_Solving_a_Real-world_Large-scale_Cutting_Stock_Problem_A_Clustering-assignment-based_Model/links/63436ef9ff870c55ce12c34a/Solving-a-Real-world-Large-scale-Cutting-Stock-Problem-A-Clustering-assignment-based-Model.pdf?_sg%5B0%5D=started_experiment_milestone&origin=journalDetail&_rtd=e30%3D","https://scholar.google.com/scholar?q=related:OyWNoZyrIO8J:scholar.google.com/&scioq=csp+minimize+cutting+waste&hl=en&as_sdt=2007&as_ylo=2015&as_yhi=2023"
0,"W Hartono, S Sugiyarto, S Marwoto…","Computer Program for Reinforced Concrete Bar Bending Schedulling to Increase Efficiency of Reinforcement",2016,"Applied Mechanics and …","Trans Tech Publ","https://www.scientific.net/AMM.845.332","",105,"2023-05-11 11:55:16","","","","",,,,,0,0.00,0,4,7,"… to minimize any waste of steel. In Surakarta, In Surakarta, the Contractor is not planning a reinforcing steel cutting… The proposed new method used to issue the CSP on a wooden cutting …","https://www.scientific.net/AMM.845.332.pdf?casa_token=pKFTqFMPoP4AAAAA:0CAAaVs28CfZwxze2CeKOHe_ADyk-AZJceMFkwsPmVokGSScc2KNbQuFmyJMS97ThbypNsEk9l4","https://scholar.google.com/scholar?q=related:7_jbDO_0y9wJ:scholar.google.com/&scioq=csp+minimize+cutting+waste&hl=en&as_sdt=2007&as_ylo=2015&as_yhi=2023"
0,"MSMM Alruwaijeh","Control and Management of Reinforcement Steel Leftovers (Case Study In Kingdom Of Bahrain Industry)",2017,"","iu.edu.jo","https://www.iu.edu.jo/files/thesis/2017/66954.pdf","",106,"2023-05-11 11:55:16","PDF","","","",,,,,0,0.00,0,1,6,"… A cutting stock problem is one of the main and classical … and test a system to minimize the waste, maximize the revenue … an optimum solution that leads to minimize losses, but to have …","https://www.iu.edu.jo/files/thesis/2017/66954.pdf","https://scholar.google.com/scholar?q=related:D7C8XACg4NEJ:scholar.google.com/&scioq=csp+minimize+cutting+waste&hl=en&as_sdt=2007&as_ylo=2015&as_yhi=2023"
3,"A Awais, A Naveed","Width-packing heuristic for grouping in two-dimensional irregular shapes cutting stock problem",2015,"Arabian Journal for Science and Engineering","Springer","https://idp.springer.com/authorize/casa?redirect_uri=https://link.springer.com/article/10.1007/s13369-014-1546-0&casa_token=OaIn-6IblRIAAAAA:qINAjIBE5R6NijWykOe5kKQRxOx8eNe94RuNMqgn1ERH9Tpz6k-HYopkpkd_tkPNhJYfA_usNR0nzRkhbw","https://scholar.google.com/scholar?cites=7570794765643125102&as_sdt=2005&sciodt=2007&hl=en",107,"2023-05-11 11:55:16","","10.1007/s13369-014-1546-0","","",,,,,3,0.38,2,2,8,"… Abstract This paper investigates cutting stock problem with … the objective of minimizing the stock sheet wastage. The research is … In this section, the literature on regular shapes CSP is dis…","https://idp.springer.com/authorize/casa?redirect_uri=https://link.springer.com/content/pdf/10.1007/s13369-014-1546-0.pdf&casa_token=of9klm0V-mIAAAAA:oIoibHMHjE3vWZ4fHmCzeqRwXXRmbRMHoWUxuj2fy_L2XXxM1FfL3OnxC7SRcoj8laPqPIRgsDsmHZcbLg","https://scholar.google.com/scholar?q=related:bpGLQbrdEGkJ:scholar.google.com/&scioq=csp+minimize+cutting+waste&hl=en&as_sdt=2007&as_ylo=2015&as_yhi=2023"
0,"FK Lemos, AC Cherri, SA de Araujo…","Minimizing saw cycles on the cutting stock problem with processing times depending on the cutting pattern",2022,"Journal of the …","Taylor &Francis","https://www.tandfonline.com/doi/abs/10.1080/01605682.2022.2081520","",108,"2023-05-11 11:55:16","","10.1080/01605682.2022.2081520","","",,,,,0,0.00,0,4,1,"… CSP assumes that objects are cut one by one in the production process. Nevertheless, some machines allow cutting … stock problem, it is possible to achieve a lower waste of raw material…","https://www.tandfonline.com/doi/pdf/10.1080/01605682.2022.2081520","https://scholar.google.com/scholar?q=related:qNUhCGK2LSMJ:scholar.google.com/&scioq=csp+minimize+cutting+waste&hl=en&as_sdt=2007&as_ylo=2015&as_yhi=2023"
1,"JCR Noriega, JR Coronado-Hernández…","Waste reduction in Rectangular Figure Cutting using a Genetic Algorithm",2016,"Ciencia y tecnología de …","shipjournal.co","http://shipjournal.co/index.php/sst/article/view/138","https://scholar.google.com/scholar?cites=2987917826358552852&as_sdt=2005&sciodt=2007&hl=en",109,"2023-05-11 11:55:16","","","","",,,,,1,0.14,0,3,7,"… ) to minimize the waste produced during the cutting process of … was a reduction of the waste as a result of the decrease in … ); two dimensional cutting stock problem (2D-CSP); and two-…","https://shipjournal.co/index.php/sst/article/download/138/394","https://scholar.google.com/scholar?q=related:FKkosm43dykJ:scholar.google.com/&scioq=csp+minimize+cutting+waste&hl=en&as_sdt=2007&as_ylo=2015&as_yhi=2023"
32,"DA Wuttke, HS Heese","Two-dimensional cutting stock problem with sequence dependent setup times",2018,"European Journal of Operational Research","Elsevier","https://www.sciencedirect.com/science/article/pii/S037722171730663X","https://scholar.google.com/scholar?cites=848125687974496658&as_sdt=2005&sciodt=2007&hl=en",110,"2023-05-11 11:55:16","","","","",,,,,32,6.40,16,2,5,"… , the issue is relevant and has been studied under the objective of waste minimization. … the two-dimensional CSP with sequence dependent setup times and tolerances to minimize total …","","https://scholar.google.com/scholar?q=related:koma1NElxQsJ:scholar.google.com/&scioq=csp+minimize+cutting+waste&hl=en&as_sdt=2007&as_ylo=2015&as_yhi=2023"
0,"AC Cherri, LH Cherri, BB Oliveira, JF Oliveira…","A stochastic programming approach to the cutting stock problem with usable leftovers",2023,"European Journal of …","Elsevier","https://www.sciencedirect.com/science/article/pii/S0377221722008682","",111,"2023-05-11 11:55:16","HTML","","","",,,,,0,0.00,0,5,1,"… In the CSP, a set of demanded items must be produced by cutting objects in … the CSP, the demand and the objects in stock are known. The demand must be met while minimizing waste …","https://www.sciencedirect.com/science/article/pii/S0377221722008682","https://scholar.google.com/scholar?q=related:F0me2d5Ikk8J:scholar.google.com/&scioq=csp+minimize+cutting+waste&hl=en&as_sdt=2007&as_ylo=2015&as_yhi=2023"
12,"S Kim, SA Kim","Framework for designing sustainable structures through steel beam reuse",2020,"Sustainability","mdpi.com","https://www.mdpi.com/890564","https://scholar.google.com/scholar?cites=753260877841988436&as_sdt=2005&sciodt=2007&hl=en",112,"2023-05-11 11:55:16","","","","",,,,,12,4.00,6,2,3,"… minimizing the amount of newly produced materials. The case of … However, implementing an algorithm to solve the CSP was … cutting patterns and plans with the least material waste are …","https://www.mdpi.com/2071-1050/12/22/9494/pdf","https://scholar.google.com/scholar?q=related:VHv4BscedAoJ:scholar.google.com/&scioq=csp+minimize+cutting+waste&hl=en&as_sdt=2007&as_ylo=2015&as_yhi=2023"
5,"P Wattanasiriseth, A Krairit","An application of cutting-stock problem in green manufacturing: a case study of wooden pallet industry",2019,"IOP Conference Series: Materials …","iopscience.iop.org","https://iopscience.iop.org/article/10.1088/1757-899X/530/1/012005/meta","https://scholar.google.com/scholar?cites=18275556063378932560&as_sdt=2005&sciodt=2007&hl=en",113,"2023-05-11 11:55:16","","10.1088/1757-899X/530/1/012005","","",,,,,5,1.25,3,2,4,"… Cutting-Stock Problem (CSP) is wildly used to solve this type of … the optimal cutting pattern to minimize the material waste while … cutting is to minimize material waste (off-cuts), the cutting …","https://iopscience.iop.org/article/10.1088/1757-899X/530/1/012005/pdf","https://scholar.google.com/scholar?q=related:UANwXmnRn_0J:scholar.google.com/&scioq=csp+minimize+cutting+waste&hl=en&as_sdt=2007&as_ylo=2015&as_yhi=2023"
0,"DKS Sampathi, Z Wang…","A Mixed-Integer Linear Programming Method for A Twodimensional Material Slitting Problem",2022,"IIE Annual Conference …","search.proquest.com","https://search.proquest.com/openview/a51e212bc6a1101fa5f851c978ce272d/1?pq-origsite=gscholar&cbl=51908","",114,"2023-05-11 11:55:16","","","","",,,,,0,0.00,0,3,1,"… In CSP a master roll is cut into smaller pieces of known widths of constant length. However, … of orthogonal guillotine cutting. The main objective is to minimize waste. Previous literature …","","https://scholar.google.com/scholar?q=related:rTT9A41B2QoJ:scholar.google.com/&scioq=csp+minimize+cutting+waste&hl=en&as_sdt=2007&as_ylo=2015&as_yhi=2023"
0,"P Tangtatswas","Algorithm for the Cutting Stock Problem with Multiple Raws and Limited Number of Cutting Knives",2017,"","rave.ohiolink.edu","https://rave.ohiolink.edu/etdc/view?acc_num=case1486572677758349","",115,"2023-05-11 11:55:16","","","","",,,,,0,0.00,0,1,6,"… meet multiple orders with minimal waste/cost. The problem … are then cut to fill the orders, while trying to minimize the total … efficient algorithms to solve the CSPs with the two extensions …","https://etd.ohiolink.edu/apexprod/rws_etd/send_file/send?accession=case1486572677758349&disposition=inline","https://scholar.google.com/scholar?q=related:CvSS1wElZtsJ:scholar.google.com/&scioq=csp+minimize+cutting+waste&hl=en&as_sdt=2007&as_ylo=2015&as_yhi=2023"
0,"I Pikula","Waste Reduction and Cost Estimation Optimization Model for Decision Making Between Outsourced and In-House Production",2019,"","search.proquest.com","https://search.proquest.com/openview/6f06369e40bfe2facae16e9d764d2729/1?pq-origsite=gscholar&cbl=18750&diss=y","",116,"2023-05-11 11:55:16","","","","",,,,,0,0.00,0,1,4,"… analysis, will be applied to the cutting stock problem (CSP) to examine the feasibility of … implement cost estimation techniques, we want to minimize waste or scrap as much as possible. …","","https://scholar.google.com/scholar?q=related:FqNQnlbnWKkJ:scholar.google.com/&scioq=csp+minimize+cutting+waste&hl=en&as_sdt=2007&as_ylo=2015&as_yhi=2023"
32,"M Habibi, MA Fazli, A Movaghar","Efficient distribution of requests in federated cloud computing environments utilizing statistical multiplexing",2019,"Future Generation Computer Systems","Elsevier","https://www.sciencedirect.com/science/article/pii/S0167739X18309038","https://scholar.google.com/scholar?cites=9058044527647041329&as_sdt=2005&sciodt=2007&hl=en",117,"2023-05-11 11:55:16","","","","",,,,,32,8.00,11,3,4,"… in the federating CSP (ie the CSP that delegates parts of its … , making this scenario more efficient with less resource waste. … between CSPs in a real world example based on minimizing …","http://sina.sharif.edu/~fazli/papers/fazli-fgcs2018.pdf","https://scholar.google.com/scholar?q=related:MacSnoGjtH0J:scholar.google.com/&scioq=csp+minimize+cutting+waste&hl=en&as_sdt=2007&as_ylo=2015&as_yhi=2023"
1,"LM Pierini, KC Poldi","Optimization of the cutting process integrated to the lot sizing in multi-plant paper production industries",2023,"Computers &Operations Research","Elsevier","https://www.sciencedirect.com/science/article/pii/S0305054823000217","https://scholar.google.com/scholar?cites=4830576675496300826&as_sdt=2005&sciodt=2007&hl=en",118,"2023-05-11 11:55:16","","","","",,,,,1,1.00,1,2,1,"… the waste of raw material, the production cost of the cut objects or the storage cost. The CSP … model that aimed to minimize inventory costs and waste in the process of cutting steel bars. …","",""
2,"CA Signorini, SA de Araujo, SC Poltroniere…","One-dimensional multi-period cutting stock problem with two stages applied to lattice slab production",2022,"Journal of the …","Taylor &Francis","https://www.tandfonline.com/doi/abs/10.1080/01605682.2022.2085067","https://scholar.google.com/scholar?cites=7381817773165567558&as_sdt=2005&sciodt=2007&hl=en",119,"2023-05-11 11:55:16","","10.1080/01605682.2022.2085067","","",,,,,2,2.00,1,4,1,"… cutting stock problem (CSP) can be a helpful approach to solve arising problems in this sector. The CSP consists of cutting … as minimizing the total waste or minimizing the cost of the cut …","https://www.tandfonline.com/doi/pdf/10.1080/01605682.2022.2085067","https://scholar.google.com/scholar?q=related:Rt4ydid8cWYJ:scholar.google.com/&scioq=csp+minimize+cutting+waste&hl=en&as_sdt=2007&as_ylo=2015&as_yhi=2023"
3,"L Climent, B O'Sullivan, R Wallace","An improved metaheuristic algorithm for maximizing demand satisfaction in the population harvest cutting stock problem",2016,"Proceedings of the International …","ojs.aaai.org","https://ojs.aaai.org/index.php/SOCS/article/view/18397","https://scholar.google.com/scholar?cites=6853405139758083156&as_sdt=2005&sciodt=2007&hl=en",120,"2023-05-11 11:55:16","","","","",,,,,3,0.43,1,3,7,"… In this paper, we deal with a variant of the Cutting Stock Problem CSP … The objective is to minimize the difference between the … However, typically there is waste from the cutting process, …","https://ojs.aaai.org/index.php/SOCS/article/download/18397/18188","https://scholar.google.com/scholar?q=related:VOwd6akvHF8J:scholar.google.com/&scioq=csp+minimize+cutting+waste&hl=en&as_sdt=2007&as_ylo=2015&as_yhi=2023"
28,"S Arulvel, A Elayaperumal…","Controlling adhesive wear failure of nickel-phosphorus coating at high load condition using crab shell particle as reinforcement",2018,"Engineering Failure …","Elsevier","https://www.sciencedirect.com/science/article/pii/S1350630717315261","https://scholar.google.com/scholar?cites=7780150629261629532&as_sdt=2005&sciodt=2007&hl=en",121,"2023-05-11 11:55:16","","","","",,,,,28,5.60,9,3,5,"… A cross section image was taken using the following procedure: coated samples were cut … -sticking properties of CSP disperse in the NiP matrix minimize the material removal from …","","https://scholar.google.com/scholar?q=related:XNgrvMal-GsJ:scholar.google.com/&scioq=csp+minimize+cutting+waste&hl=en&as_sdt=2007&as_ylo=2015&as_yhi=2023"
1,"D Wu, C Yan","Balanced approach for the two-dimensional rectangular guillotine cutting stock problem with setup cost",2018,"IOP Conference Series: Materials Science and …","iopscience.iop.org","https://iopscience.iop.org/article/10.1088/1757-899X/452/2/022087/meta","https://scholar.google.com/scholar?cites=4901667169164399686&as_sdt=2005&sciodt=2007&hl=en",122,"2023-05-11 11:55:16","","10.1088/1757-899X/452/2/022087","","",,,,,1,0.20,1,2,5,"… To our knowledge, there are mainly three categories of solution methods for CSP-S, CSP-… formulation for minimizing the amount of waste and the number of different cutting patterns. He …","https://iopscience.iop.org/article/10.1088/1757-899X/452/2/022087/pdf","https://scholar.google.com/scholar?q=related:RhQ9-VE4BkQJ:scholar.google.com/&scioq=csp+minimize+cutting+waste&hl=en&as_sdt=2007&as_ylo=2015&as_yhi=2023"
